2801,D,4,2,1,45 days,N/A,Ibid. Inspection protocol. Article VII. 2Each party shall have the right to conduct new facility inspections 45 days after entry into force of the Treaty and thereafter. Such inspections shall be conducted at facilities that were not specified in the notification provided in accordance with paragraph 1 of Section I of the Notification protocol and that were specified in notifications provided in accordance with paragraph 3 of Section I of the Notification protocol.,1995-01-19,Ibid. Inspection protocol. Article VII. 2Each party shall have the right to conduct new facility inspections 45 days after entry into force of the Treaty and thereafter. Such inspections shall be conducted at facilities that were not specified in the notification provided in accordance with paragraph 1 of Section I of the Notification protocol and that were specified in notifications provided in accordance with paragraph 3 of Section I of the Notification protocol.,3,N/A,N/A,Assumed,2009-12-05,NTI.2024.Accessed 22022024. https://www.nti.org/education-center/treaties-and-regimes/treaties-between-united-states-america-and-union-soviet-socialist-republics-strategic-offensive-reductions-start-i-start-ii/: START I expired on 5 December(2009). Negotiations were put on hold during the American and Russian holidays.,1,0,N/A,N/A,Upon notification prior to new facility,N/A,N/A,N/A,Ibid. Inspection protocol. Article VII. 2Each party shall have the right to conduct new facility inspections 45 days after entry into force of the Treaty and thereafter. Such inspections shall be conducted at facilities that were not specified in the notification provided in accordance with paragraph 1 of Section I of the Notification protocol and that were specified in notifications provided in accordance with paragraph 3 of Section I of the Notification protocol.,5,N/A,Ibid. Inspection protocol. Article VII. 2Each party shall have the right to conduct new facility inspections 45 days after entry into force of the Treaty and thereafter. Such inspections shall be conducted at facilities that were not specified in the notification provided in accordance with paragraph 1 of Section I of the Notification protocol and that were specified in notifications provided in accordance with paragraph 3 of Section I of the Notification protocol.,0,N/A,Ibid. Inspection protocol. Article VII. 2Each party shall have the right to conduct new facility inspections 45 days after entry into force of the Treaty and thereafter. Such inspections shall be conducted at facilities that were not specified in the notification provided in accordance with paragraph 1 of Section I of the Notification protocol and that were specified in notifications provided in accordance with paragraph 3 of Section I of the Notification protocol.,0,N/A,N/A,1,"ICBM bases; submarine bases; ICBM loading facilities; SLBM loading facilities; repair facilities for ICBMs, SLBMs, or mobile launchers of ICBMs; storage facilities for ICBMs, SLBMs, mobile launchers of ICBMs, heavy bombers, or former heavy bombers; training facilities for ICBMs, SLBMs, or heavy bombers; conversion or elimination facilities for ICBMs, SLBMs, or mobile launchers of ICBMs; test ranges; air bases for heavy bombers, except for air bases for heavy bombers equipped for nuclear armaments other than long-range nuclear ALCMs, at which are based only heavy bombers of a type from none of which a long-range nuclear ALCM has been flight-tested; and air bases for former heavy bombers","Ibid. Inspection protocol VII.5. Each party shall have the right to conduct baseline data inspections, data update inspections, and new facility inspections at any of the following facilities. ICBM bases; submarine bases; ICBM loading facilities; SLBM loading facilities; repair facilities for ICBMs, SLBMs, or mobile launchers of ICBMs; storage facilities for ICBMs, SLBMs, mobile launchers of ICBMs, heavy bombers, or former heavy bombers; training facilities for ICBMs, SLBMs, or heavy bombers; conversion or elimination facilities for ICBMs, SLBMs, or mobile launchers of ICBMs; test ranges; air bases for heavy bombers, except for air bases for heavy bombers equipped for nuclear armaments other than long-range nuclear ALCMs, at which are based only heavy bombers of a type from none of which a long-range nuclear ALCM has been flight-tested; and air bases for former heavy bombers",0,N/A,N/A,0,N/A,N/A,0,N/A,Assumed,0,N/A,N/A,N/A,Ibid. Inspection protocol. Article VII. 2Each party shall have the right to conduct new facility inspections 45 days after entry into force of the Treaty and thereafter. Such inspections shall be conducted at facilities that were not specified in the notification provided in accordance with paragraph 1 of Section I of the Notification protocol and that were specified in notifications provided in accordance with paragraph 3 of Section I of the Notification protocol.,0,N/A,N/A,0,N/A,N/A,0,N/A,N/A,0,N/A,N/A,1,"Initial Possession-inspection [Article XI.4], initiated 45 days after entry into force and activated upon notification for the duration of the agreement [Protocol on Inspections. VII.3]. Confirmation of the accuracy of data on the numbers and types of items specified in the notifications provided for a new facilities [Article XI.4].",Ibid. Inspection protocol. Article VII. 2Each party shall have the right to conduct new facility inspections 45 days after entry into force of the Treaty and thereafter. Such inspections shall be conducted at facilities that were not specified in the notification provided in accordance with paragraph 1 of Section I of the Notification protocol and that were specified in notifications provided in accordance with paragraph 3 of Section I of the Notification protocol.,0,N/A,N/A,0,N/A,N/A,0,N/A,N/A,0,N/A,N/A,0,N/A,0,N/A,Intial Possession-inspection
2801,E,5,2,1,165 days,N/A,"Ibid. Article VIII.1. Each party shall have the right 165 days after entry into force of the Treaty and thereafter, to conduct suspect-site inspections.",1995-05-19,"Ibid. Article VIII.1. Each party shall have the right 165 days after entry into force of the Treaty and thereafter, to conduct suspect-site inspections.",3,N/A,N/A,Assumed,2009-12-05,NTI.2024.Accessed 22022024. https://www.nti.org/education-center/treaties-and-regimes/treaties-between-united-states-america-and-union-soviet-socialist-republics-strategic-offensive-reductions-start-i-start-ii/: START I expired on 5 December(2009). Negotiations were put on hold during the American and Russian holidays.,1,N/A,N/A,N/A,N/A,N/A,N/A,N/A,"Ibid. Article VIII.1. Each party shall have the right 165 days after entry into force of the Treaty and thereafter, to conduct suspect-site inspections. Comment:  a conducted Challenged Imlementation-inspection reduces the number of Updated Possession-inspections by one [Protocol on Inspections article VIII.2].",5,N/A,"Ibid. Article VIII.1. Each party shall have the right 165 days after entry into force of the Treaty and thereafter, to conduct suspect-site inspections.",2,N/A,"Ibid. Article VIII.1. Each party shall have the right 165 days after entry into force of the Treaty and thereafter, to conduct suspect-site inspections.",0,N/A,N/A,1,"each facility specified as subject to suspect-site inspections in paragraph 12 of Annex I to the Memorandum of Understanding or in a notification provided in accordance with paragraph 3 of Section I of the Notification protocol, if it is provided for in paragraph 3 of this Section.","Ibid. Inspection protocol. VIII.2. Each party shall have the right to conduct suspect-site inspections at each facility specified as subject to suspect-site inspections in paragraph 12 of Annex I to the Memorandum of Understanding or in a notification provided in accordance with paragraph 3 of Section I of the Notification protocol, if it is provided for in paragraph 3 of this Section.",0,N/A,N/A,0,N/A,N/A,0,N/A,Assumed,0,N/A,N/A,N/A,"Ibid. Article VIII.1. Each party shall have the right 165 days after entry into force of the Treaty and thereafter, to conduct suspect-site inspections.",0,N/A,N/A,0,N/A,N/A,0,N/A,N/A,0,N/A,N/A,1,"Challenged Implementation-inspection, initiated 165 days after entry into force and activated on a state-party request for the duration of the agreement (note: a conducted Challenged Imlementation-inspection reduces the number of Updated Possession-inspections by one) [Protocol on Inspections Article VIII.2]. Inspections confirm that the covert assembly of ICBMs for mobile launchers of ICBMs or the covert assembly of the first stages of such ICBMs is not occurring at a facility of the other party [Article XI.5].",N/A,0,N/A,N/A,0,N/A,N/A,0,N/A,N/A,0,N/A,N/A,0,N/A,0,N/A,Challenged Implementation-inspection
2801,F,6,2,1,205 days,N/A,"Ibid. protocol on inspection. IX.1. Each party shall have the right, 205 days after entry into force of the Treaty and thereafter, to conduct reentry vehicle inspections.1 Each party shall have the right to conduct a total of ten reentry vehicle inspections each year, with no more than two such inspections each year at any one facility",1995-06-28,"Ibid. protocol on inspection. IX.1. Each party shall have the right, 205 days after entry into force of the Treaty and thereafter, to conduct reentry vehicle inspections.1 Each party shall have the right to conduct a total of ten reentry vehicle inspections each year, with no more than two such inspections each year at any one facility",3,N/A,N/A,Assumed,2009-12-05,NTI.2024.Accessed 22022024. https://www.nti.org/education-center/treaties-and-regimes/treaties-between-united-states-america-and-union-soviet-socialist-republics-strategic-offensive-reductions-start-i-start-ii/: START I expired on 5 December(2009). Negotiations were put on hold during the American and Russian holidays.,0,2,10/year,N/A,N/A,N/A,N/A,N/A,"Ibid. protocol on inspection. IX.1. Each party shall have the right, 205 days after entry into force of the Treaty and thereafter, to conduct reentry vehicle inspections.1 Each party shall have the right to conduct a total of ten reentry vehicle inspections each year, with no more than two such inspections each year at any one facility",5,N/A,"Ibid. protocol on inspection. IX.1. Each party shall have the right, 205 days after entry into force of the Treaty and thereafter, to conduct reentry vehicle inspections.1 Each party shall have the right to conduct a total of ten reentry vehicle inspections each year, with no more than two such inspections each year at any one facility",1,N/A,"Ibid. protocol on inspection. IX.1. Each party shall have the right, 205 days after entry into force of the Treaty and thereafter, to conduct reentry vehicle inspections.1 Each party shall have the right to conduct a total of ten reentry vehicle inspections each year, with no more than two such inspections each year at any one facility",0,N/A,N/A,1,"ICBM bases, submarine bases",Ibid. Inspection protocol. XI.2. Each party shall have the right to conduct reentry vehicle inspections at ICBM bases and at submarine bases. ,0,N/A,N/A,0,N/A,N/A,0,N/A,Assumed,0,N/A,N/A,N/A,"Ibid. protocol on inspection. IX.1. Each party shall have the right, 205 days after entry into force of the Treaty and thereafter, to conduct reentry vehicle inspections.1 Each party shall have the right to conduct a total of ten reentry vehicle inspections each year, with no more than two such inspections each year at any one facility",0,N/A,N/A,0,N/A,N/A,0,N/A,N/A,0,N/A,N/A,1,"Updated Possession-inspection, initiated 205 days after entry into force and activated on a quota of 10 inspection per yer for the duration of the agreement [Protocol on Inspections Article IX.1. Confirmation that ballistic missiles located at ISBM bases and t submarine bases contain no more reentry vehicles than the number of warheads attributed to them under the agreement [Article XI.6]. ","Ibid. protocol on inspection. IX.1. Each party shall have the right, 205 days after entry into force of the Treaty and thereafter, to conduct reentry vehicle inspections.1 Each party shall have the right to conduct a total of ten reentry vehicle inspections each year, with no more than two such inspections each year at any one facility",0,N/A,N/A,0,N/A,N/A,0,N/A,N/A,0,N/A,N/A,0,N/A,0,N/A,Updated Possession-inspection
2801,G,7,2,1,165 days,N/A,"Ibid. Article XIII.1. Each party shall have the right, 165 days after entry into force of the Treaty and thereafter, to conduct formerly declared facility inspections. ",1995-05-19,"Ibid. Article XIII.1. Each party shall have the right, 165 days after entry into force of the Treaty and thereafter, to conduct formerly declared facility inspections. ",3,N/A,N/A,Assumed,2009-12-05,NTI.2024.Accessed 22022024. https://www.nti.org/education-center/treaties-and-regimes/treaties-between-united-states-america-and-union-soviet-socialist-republics-strategic-offensive-reductions-start-i-start-ii/: START I expired on 5 December(2009). Negotiations were put on hold during the American and Russian holidays.,0,2,3/year,N/A,N/A,N/A,N/A,N/A,"Ibid. Article XIII.1. Each party shall have the right, 165 days after entry into force of the Treaty and thereafter, to conduct formerly declared facility inspections. ",5,N/A,"Ibid. Article XIII.1. Each party shall have the right, 165 days after entry into force of the Treaty and thereafter, to conduct formerly declared facility inspections. ",3,N/A,"Ibid. Article XIII.1. Each party shall have the right, 165 days after entry into force of the Treaty and thereafter, to conduct formerly declared facility inspections. ",0,N/A,N/A,1," ICBM bases; submarine bases; ICBM loading facilities; SLBM loading facilities; repair facilities for ICBMs, SLBMs, or mobile launchers of ICBMs; storage facilities for ICBMs, SLBMs, or mobile launchers of ICBMs; training facilities for ICBMs or SLBMs; conversion or elimination facilities for ICBMs, SLBMs, or mobile launchers of ICBMs; and test ranges. ","Ibid. Inspection protocol. XIII.2. Each party shall have the right to conduct formerly declared facility inspections at any of the following facilities. ICBM bases; submarine bases; ICBM loading facilities; SLBM loading facilities; repair facilities for ICBMs, SLBMs, or mobile launchers of ICBMs; storage facilities for ICBMs, SLBMs, or mobile launchers of ICBMs; training facilities for ICBMs or SLBMs; conversion or elimination facilities for ICBMs, SLBMs, or mobile launchers of ICBMs; and test ranges. ",0,N/A,N/A,0,N/A,N/A,0,N/A,Assumed,0,N/A,N/A,N/A,"Ibid. Article XIII.1. Each party shall have the right, 165 days after entry into force of the Treaty and thereafter, to conduct formerly declared facility inspections. ",0,N/A,N/A,0,N/A,N/A,0,N/A,N/A,0,N/A,N/A,1,"Completed Elimination-insepection, initiated 165 days after and entry into force and activated on a quota of three inspections per year for the duration of the agreement [Article XI.9]. Confirmation that facilities, for which notification of the  elimination has been provided in accordance with the agreement, are not being used for purposes inconsistent with the agreement [Article XI.9]. ","Ibid. Article XIII.1. Each party shall have the right, 165 days after entry into force of the Treaty and thereafter, to conduct formerly declared facility inspections. ",0,N/A,N/A,0,N/A,N/A,0,N/A,N/A,0,N/A,N/A,0,N/A,0,N/A,Completed Elimination-inspection
2801,H,8,2,0,N/A,N/A,Assumed,1994-12-05,Assumed,3,N/A,N/A,Assumed,2009-12-05,NTI.2024.Accessed 22022024. https://www.nti.org/education-center/treaties-and-regimes/treaties-between-united-states-america-and-union-soviet-socialist-republics-strategic-offensive-reductions-start-i-start-ii/: START I expired on 5 December(2009). Negotiations were put on hold during the American and Russian holidays.,1,0,N/A,N/A,Upon noticifation of completed elimination,N/A,N/A,N/A,Ibid. Article XI.9. Each party shall have the right to conduct close-out inspections to confirm that the elimination of facilities has been completed.,5,N/A,Ibid. Article XI.9. Each party shall have the right to conduct close-out inspections to confirm that the elimination of facilities has been completed.,3,N/A,Ibid. Article XI.9. Each party shall have the right to conduct close-out inspections to confirm that the elimination of facilities has been completed.,0,N/A,N/A,1,"ICBM bases; submarine bases; ICBM loading facilities; SLBM loading facilities; repair facilities for ICBMs, SLBMs, or mobile launchers of ICBMs; storage facilities for ICBMs, SLBMs, mobile launchers of ICBMs, heavy bombers, or former heavy bombers; training facilities for ICBMs, SLBMs, or heavy bombers; conversion or elimination facilities for ICBMs, SLBMs, or mobile launchers of ICBMs; test ranges; air bases for heavy bombers; and air bases for former heavy bombers.","Ibid. Article XII.2. ICBM bases; submarine bases; ICBM loading facilities; SLBM loading facilities; repair facilities for ICBMs, SLBMs, or mobile launchers of ICBMs; storage facilities for ICBMs, SLBMs, mobile launchers of ICBMs, heavy bombers, or former heavy bombers; training facilities for ICBMs, SLBMs, or heavy bombers; conversion or elimination facilities for ICBMs, SLBMs, or mobile launchers of ICBMs; test ranges; air bases for heavy bombers; and air bases for former heavy bombers.",0,N/A,N/A,0,N/A,N/A,0,N/A,Assumed,0,N/A,N/A,N/A,Ibid. Article XI.9. Each party shall have the right to conduct close-out inspections to confirm that the elimination of facilities has been completed.,0,N/A,N/A,0,N/A,N/A,0,N/A,N/A,0,N/A,N/A,1,"Completed Elimination-inspection, initiated at entry into force and activated upon notification for the duration of the agreement. Confirmation that the elimination of a facility has been completed [Article XI.9].",N/A,0,N/A,N/A,0,N/A,N/A,0,N/A,N/A,0,N/A,N/A,0,N/A,0,N/A,Completed Elimination-inspection
2801,I,9,2,0,N/A,N/A,Assumed,1994-12-05,Assumed,3,N/A,N/A,Assumed,2009-12-05,NTI.2024.Accessed 22022024. https://www.nti.org/education-center/treaties-and-regimes/treaties-between-united-states-america-and-union-soviet-socialist-republics-strategic-offensive-reductions-start-i-start-ii/: START I expired on 5 December(2009). Negotiations were put on hold during the American and Russian holidays.,1,0,N/A,N/A,Upon notification on the completion of dispersal-activities,N/A,N/A,N/A,"Ibidd. Inspection protocol X.1. Each party shall have the right to conduct post-dispersal inspections of deployed mobile launchers of ICBMs and their associated missiles after a notification has been provided in accordance with paragraph 12 of Section II of the Notification protocol. Such inspections shall be conducted at ICBM bases for mobile launchers of ICBMs specified in such a notification, subject to the following. ",5,N/A,"Ibidd. Inspection protocol X.1. Each party shall have the right to conduct post-dispersal inspections of deployed mobile launchers of ICBMs and their associated missiles after a notification has been provided in accordance with paragraph 12 of Section II of the Notification protocol. Such inspections shall be conducted at ICBM bases for mobile launchers of ICBMs specified in such a notification, subject to the following. ",3,N/A,"Ibidd. Inspection protocol X.1. Each party shall have the right to conduct post-dispersal inspections of deployed mobile launchers of ICBMs and their associated missiles after a notification has been provided in accordance with paragraph 12 of Section II of the Notification protocol. Such inspections shall be conducted at ICBM bases for mobile launchers of ICBMs specified in such a notification, subject to the following. ",0,N/A,N/A,1,ICBM bases for mobile launhers of ICBMs,"Ibidd. Inspection protocol X.1. Each party shall have the right to conduct post-dispersal inspections of deployed mobile launchers of ICBMs and their associated missiles after a notification has been provided in accordance with paragraph 12 of Section II of the Notification protocol. Such inspections shall be conducted at ICBM bases for mobile launchers of ICBMs specified in such a notification, subject to the following. ",0,N/A,N/A,0,N/A,N/A,0,N/A,Assumed,0,N/A,N/A,N/A,"Ibid. protocol on inspection. IX.1. Each party shall have the right, 205 days after entry into force of the Treaty and thereafter, to conduct reentry vehicle inspections.1 Each party shall have the right to conduct a total of ten reentry vehicle inspections each year, with no more than two such inspections each year at any one facility",0,N/A,N/A,0,N/A,N/A,0,N/A,N/A,0,N/A,N/A,1,"Updated Possession-inspection, initiated 205 days after entry into force and activated upon a state-party notification of the completion of dispersal-activities for the duration of the agreement. Confirmation of the the number of mobile launchers of ICBMs and their associated missiles that are located at the inspected ICBM base [Article XI.7].","Ibid. protocol on inspection. IX.1. Each party shall have the right, 205 days after entry into force of the Treaty and thereafter, to conduct reentry vehicle inspections.1 Each party shall have the right to conduct a total of ten reentry vehicle inspections each year, with no more than two such inspections each year at any one facility",0,N/A,N/A,0,N/A,N/A,0,N/A,N/A,0,N/A,N/A,0,N/A,0,N/A,Completed Possession-inspection
2801,J,10,2,1,45 days ,N/A,"Ibid. Article XI.1. Each party shall conduct, and shall have the right to conduct, 45 days after entry into force of the Treaty and thereafter, conversion or elimination inspections in accordance with the provisions provided for in this Section and the procedures provided for in the Conversion or Elimination protocol. ",1995-01-19,"Ibid. Article XI.1. Each party shall conduct, and shall have the right to conduct, 45 days after entry into force of the Treaty and thereafter, conversion or elimination inspections in accordance with the provisions provided for in this Section and the procedures provided for in the Conversion or Elimination protocol. ",3,N/A,N/A,Assumed,2009-12-05,NTI.2024.Accessed 22022024. https://www.nti.org/education-center/treaties-and-regimes/treaties-between-united-states-america-and-union-soviet-socialist-republics-strategic-offensive-reductions-start-i-start-ii/: START I expired on 5 December(2009). Negotiations were put on hold during the American and Russian holidays.,1,0,N/A,N/A,Upon notification of completed elimination,N/A,N/A,N/A,"Ibid. Article XI.1. Each party shall conduct, and shall have the right to conduct, 45 days after entry into force of the Treaty and thereafter, conversion or elimination inspections in accordance with the provisions provided for in this Section and the procedures provided for in the Conversion or Elimination protocol. ",5,N/A,"Ibid. Article XI.1. Each party shall conduct, and shall have the right to conduct, 45 days after entry into force of the Treaty and thereafter, conversion or elimination inspections in accordance with the provisions provided for in this Section and the procedures provided for in the Conversion or Elimination protocol. ",3,N/A,"Ibid. Article XI.1. Each party shall conduct, and shall have the right to conduct, 45 days after entry into force of the Treaty and thereafter, conversion or elimination inspections in accordance with the provisions provided for in this Section and the procedures provided for in the Conversion or Elimination protocol. ",0,N/A,N/A,1,,"Ibid. Article XI.1. Each party shall conduct, and shall have the right to conduct, 45 days after entry into force of the Treaty and thereafter, conversion or elimination inspections in accordance with the provisions provided for in this Section and the procedures provided for in the Conversion or Elimination protocol. ",0,N/A,N/A,0,N/A,N/A,0,N/A,Assumed,0,N/A,N/A,N/A,"Ibid. Article XI.1. Each party shall conduct, and shall have the right to conduct, 45 days after entry into force of the Treaty and thereafter, conversion or elimination inspections in accordance with the provisions provided for in this Section and the procedures provided for in the Conversion or Elimination protocol. ",0,N/A,N/A,0,N/A,N/A,0,N/A,N/A,0,N/A,N/A,1,"Completed Elimination/Conversion-Inspection, initiated 45 days after entry into force and activated upon a upon a state-party notification of completed elimination or conversion for the duration of the agreement. Confirmation of the completed state of converted or eliminated strategic offensive arms subject to conversion or elimination under the agreement [Article XI.8].","Ibid. Article XI.1. Each party shall conduct, and shall have the right to conduct, 45 days after entry into force of the Treaty and thereafter, conversion or elimination inspections in accordance with the provisions provided for in this Section and the procedures provided for in the Conversion or Elimination protocol. ",0,N/A,N/A,0,N/A,N/A,0,N/A,N/A,0,N/A,N/A,0,N/A,0,N/A,Completed Elimination(conversion)-inspection
