agreement_id,mechanism_letter,mechanism_nr,mechanism_type_administrative_filter,verified_compliance_mechanism_initiation,verified_compliance_mechanism_initiation_set_time,verified_compliance_mechanism_initiation_other,c_verified_compliance_mechanism_initiation,verified_compliance_mechanism_initiation_time,c_verified_compliance_mechanism_initiation_time,verified_compliance_mechanism_duration,verified_compliance_mechanism_duration_set,verified_compliance_mechanism_duration_other,c_verified_compliance_mechanism_duration,verified_compliance_mechanism_duration_time,c_verified_compliance_mechanism_duration_time,verified_compliance_mechanism_trigger_type,verified_compliance_mechanism_agreement_trigger_type,verified_compliance_mechanism_agreement_trigger_qouta,verified_compliance_mechanism_agreement_trigger_cyclical,verified_compliance_mechanism_agreement_trigger_upon_notification,trigger_circumstance,trigger_association,verified_compliance_mechanism_trigger_other,c_verified_compliance_mechanism_trigger,verified_compliance_mechanism_category,verified_compliance_mechanism_category_other ,c_verified_compliance_mechanism_category,verified_compliance_mechanism_type,verified_compliance_mechanism_type_other,c_verified_compliance_mechanism_type,verified_compliance_mechanism_area_access,verified_compliance_mechanism_area,c_verified_compliance_mechanism_area_access,verified_compliance_mechanism_facility_access,verified_compliance_mechanism_facility,c_verified_compliance_mechanism_facility_access,verified_compliance_mechanism_item_access,verified_compliance_mechanism_item,c_verified_compliance_mechanism_item_access,verified_compliance_mechanism_item_section_access,verified_compliance_mechanism_item_section,c_verified_compliance_mechanism_item_section_access,verified_compliance_mechanism_territory,verified_compliance_mechanism_territory_other,c_verified_compliance_mechanism_territory,verified_compliance_mechanism_inspector_type,verified_compliance_mechanism_inspector_type_established_body,verified_compliance_mechanism_inspector_type_utlilized_body,verified_compliance_mechanism_inspector_other,c_verified_compliance_mechanism_inspector_type,verified_compliance_mechanism_development,verified_compliance_mechanism_development_access,c_verified_compliance_mechanism_development,verified_compliance_mechanism_testing,verified_compliance_mechanism_testing_access,c_verified_compliance_mechanism_testing,verified_compliance_mechanism_production,verified_compliance_mechanism_production_access,c_verified_compliance_mechanism_production,verified_compliance_mechanism_acquisition,verified_compliance_mechanism_acquisition_access,c_verified_compliance_mechanism_acquisition,verified_compliance_mechanism_possession,verified_compliance_mechanism_possession_access,c_verifed_compliance_mechanism_possession,verified_compliance_mechanism_stationing,verified_compliance_mechanism_stationing_access,c_verified_compliance_mechanism_stationing,verified_compliance_mechanism_transfer,verified_compliance_mechanism_transfer_access,c_verified_compliance_mechanism_transfer,verified_compliance_mechanism_use,verified_compliance_mechanism_use_access,c_verified_compliance_mechanism_use,verified_compliance_mechanism_general,verified_compliance_mechanism_general_access,c_verified_compliance_mechanism_general,ntm_interferene,c_ntm_interference,ntm_concealment,c_ntm_concealment,verified_compliance_mechanism_amc_typology
050,A,1,2,0,N/A,N/A,Assumed,1961-06-23,Unoda. Accessed 2024-04-06.https://treaties.unoda.org/t/antarctic,3,N/A,N/A,Assumed,Available,N/A,2,N/A,N/A,N/A,N/A,N/A,N/A,N/A,"Ibid. Article VII. 2-3. 2.Each observer designated in accordance with the provisions of paragraph 1 of this Article shall have complete freedom of access at any time to any or all areas of Antarctica.3. All areas of Antarctica, including all stations, installations and equipment within those areas, and all ships and aircraft at points of discharging or embarking cargoes or personnel in Antarctica, shall be open at all times to inspection by any observers designated in accordance with paragraph 1 of this Article.",5,N/A,"Ibid. Article VII. 2-3. 2.Each observer designated in accordance with the provisions of paragraph 1 of this Article shall have complete freedom of access at any time to any or all areas of Antarctica.3. All areas of Antarctica, including all stations, installations and equipment within those areas, and all ships and aircraft at points of discharging or embarking cargoes or personnel in Antarctica, shall be open at all times to inspection by any observers designated in accordance with paragraph 1 of this Article.",1,N/A,"Ibid. Article VII. 2-3. 2.Each observer designated in accordance with the provisions of paragraph 1 of this Article shall have complete freedom of access at any time to any or all areas of Antarctica.3. All areas of Antarctica, including all stations, installations and equipment within those areas, and all ships and aircraft at points of discharging or embarking cargoes or personnel in Antarctica, shall be open at all times to inspection by any observers designated in accordance with paragraph 1 of this Article.",1,"Inspectors have access to all areas of Antarctica, including all stations, installations and equipment within those areas. All ships and aircraft at points of discharging or embarking cargoes or personnel in Antarctica [Article VII.3].","Ibid. Article VII.  All areas of Antarctica, including all stations, installations and equipment within those areas, and all ships and aircraft at points of discharging or embarking cargoes or personnel in Antarctica, shall be open at all times to inspection by any observers designated in accordance with paragraph 1 of this Article.",0,N/A,N/A,1,"On-site/locations, inspectors have access to all stations, installations and equipment within those areas. All ships and aircraft at points of discharging or embarking cargoes or personnel in Antarctica [Article VII.3].","Ibid. Article VII.  All areas of Antarctica, including all stations, installations and equipment within those areas, and all ships and aircraft at points of discharging or embarking cargoes or personnel in Antarctica, shall be open at all times to inspection by any observers designated in accordance with paragraph 1 of this Article.",0,N/A,N/A,2,Antarctica,"Ibid. Article VII.  All areas of Antarctica, including all stations, installations and equipment within those areas, and all ships and aircraft at points of discharging or embarking cargoes or personnel in Antarctica, shall be open at all times to inspection by any observers designated in accordance with paragraph 1 of this Article.",0,N/A,N/A,N/A,"Ibid. Article VII. 1.  In order to promote the objectives and ensure the observance of the provisions of the present Treaty, each Contracting party whose representatives are entitled to participate in the meetings referred to in Article IX of the Treaty shall have the right to designate observers to carry out any inspection provided for by the present Article. Observers shall be nationals of the Contracting parties which designate them. The names of observers shall be communicated to every other Contracting party having the right to designate observers, and like notice shall be given of the termination of their appointment.",0,N/A,N/A,0,N/A,N/A,0,N/A,N/A,0,N/A,N/A,0,N/A,N/A,0,N/A,N/A,0,N/A,N/A,0,N/A,N/A,1,"Updated Implementation-inspection, initiated at entry into force and activated at any time for the duration of  the agreement [Article VII.2]. Inspectors have access to all areas of Antarctica, including all stations, installations  and equipment within those areas. All ships and aircraft at points of discharging or embarking cargoes or personnel in Antarctica [Article VII.3].","Ibid. Article VII.  All areas of Antarctica, including all stations, installations and equipment within those areas, and all ships and aircraft at points of discharging or embarking cargoes or personnel in Antarctica, shall be open at all times to inspection by any observers designated in accordance with paragraph 1 of this Article.",0,N/A,0,N/A,Updated Implementation-inspection
050,B,2,2,0,N/A,N/A,Assumed,1961-06-23,Unoda. Accessed 2024-04-06.https://treaties.unoda.org/t/antarctic,3,N/A,N/A,Assumed,Available,N/A,2,N/A,N/A,N/A,N/A,N/A,N/A,N/A,Ibid. Article VII.3. Aerial observation may be carried out at any time over any or all areas of Antarctica by any of the Contracting parties having the right to designate observers.,7,Flight Observation,Ibid. Article VII.3. Aerial observation may be carried out at any time over any or all areas of Antarctica by any of the Contracting parties having the right to designate observers.,1,N/A,Ibid. Article VII.3. Aerial observation may be carried out at any time over any or all areas of Antarctica by any of the Contracting parties having the right to designate observers.,1,Inspectors have access to any or all areas of Antarctica [Article VII.2].,Ibid. Article VII.3. Aerial observation may be carried out at any time over any or all areas of Antarctica by any of the Contracting parties having the right to designate observers.,0,N/A,N/A,0,N/A,N/A,0,N/A,N/A,2,Antarctica,Ibid. Article VII.3. Aerial observation may be carried out at any time over any or all areas of Antarctica by any of the Contracting parties having the right to designate observers.,0,N/A,N/A,N/A,Ibid. Article VII.3. Aerial observation may be carried out at any time over any or all areas of Antarctica by any of the Contracting parties having the right to designate observers.,0,N/A,N/A,0,N/A,N/A,0,N/A,N/A,0,N/A,N/A,0,N/A,N/A,0,N/A,N/A,0,N/A,N/A,0,N/A,N/A,1,"Updated Implementation-observation, initiated at entry into force and activated at any time for the duration of the agreement [Article VII.2]. Aerial observation may be carried out over any or all areas of Antarctica by any of the contracting parties having the mandate to designate observers [Article VII.2].",Ibid. Article VII.3. Aerial observation may be carried out at any time over any or all areas of Antarctica by any of the Contracting parties having the right to designate observers.,0,N/A,0,N/A,"Other: Aerial Observation, AMC Typlology not applicable"
070,A,1,2,0,N/A,N/A,Assumed,1967-09-20,"Comment: the agreement enters into force for each party individually, the first date of entry into force is considered. ",3,N/A,N/A,Assumed,Available,N/A,1,N/A,N/A,N/A,Upon notification prior to the planning and conducting of a nuclear explosion.,N/A,N/A,N/A,"Ibid. Article 18.3. The General Secretary and the technical personnel designated by the Council and the International Atomic Energy Agency may observe all the preparations, including the explosion of the device, and shall have unrestricted access to any area in the vicinity of the site of the explosion in order to ascertain whether the device and the procedures followed during the explosion are in conformity with the information supplied under paragraph 2 of this article and the other provisions of this Treaty. ",5,N/A,"Ibid. Article 18.3. The General Secretary and the technical personnel designated by the Council and the International Atomic Energy Agency may observe all the preparations, including the explosion of the device, and shall have unrestricted access to any area in the vicinity of the site of the explosion in order to ascertain whether the device and the procedures followed during the explosion are in conformity with the information supplied under paragraph 2 of this article and the other provisions of this Treaty. ",1,N/A,"Ibid. Article 18.3. The General Secretary and the technical personnel designated by the Council and the International Atomic Energy Agency may observe all the preparations, including the explosion of the device, and shall have unrestricted access to any area in the vicinity of the site of the explosion in order to ascertain whether the device and the procedures followed during the explosion are in conformity with the information supplied under paragraph 2 of this article and the other provisions of this Treaty. ",1,Inspectors have unrestricted access to any area in the vicinity of the site of the explosion.,"Ibid. Article 18.3. The General Secretary and the technical personnel designated by the Council and the International Atomic Energy Agency may observe all the preparations, including the explosion of the device, and shall have unrestricted access to any area in the vicinity of the site of the explosion in order to ascertain whether the device and the procedures followed during the explosion are in conformity with the information supplied under paragraph 2 of this article and the other provisions of this Treaty. ",0,N/A,N/A,0,N/A,N/A,0,N/A,N/A,0,N/A,Assumed,1,The General Secretary(and te technical personnel)designated by the Council,The IAEA,N/A,"Comment. Utlilized AND established body Ibid. Article 18.3. The General Secretary and the technical personnel designated by the Council and the International Atomic Energy Agency may observe all the preparations, including the explosion of the device, and shall have unrestricted access to any area in the vicinity of the site of the explosion in order to ascertain whether the device and the procedures followed during the explosion are in conformity with the information supplied under paragraph 2 of this article and the other provisions of this Treaty. ",0,N/A,N/A,0,N/A,N/A,0,N/A,N/A,0,N/A,N/A,0,N/A,N/A,0,N/A,N/A,0,N/A,N/A,1,"Updated Use-inspection, initiated at entry into force and activated upon a state-party notification for the duration of the agreement. The objective of the  mechanism is to confirm the declared characteristics, and execution of, a peaceful nuclear explosion. Technical personnel designated by the Council and the IAEA are the designated inspectors. Inspectors have access to observe all the preparations, including the explosion of the device and to any area in the vicinity of the site of the explosion [Article 18.3].","Ibid. Article 18.3. The General Secretary and the technical personnel designated by the Council and the International Atomic Energy Agency may observe all the preparations, including the explosion of the device, and shall have unrestricted access to any area in the vicinity of the site of the explosion in order to ascertain whether the device and the procedures followed during the explosion are in conformity with the information supplied under paragraph 2 of this article and the other provisions of this Treaty. ",0,N/A,N/A,0,N/A,0,N/A,Updated Use-inspection
070,B,2,2,0,N/A,N/A,Assumed,1967-09-20,"Comment: the agreement enters into force for each party individually, the first date of entry into force is considered. ",3,N/A,N/A,Assumed,Available,Assumed,2,N/A,N/A,N/A,N/A,N/A,N/A,N/A,"Ibid. Article 16.1. The International Atomic Energy Agency and the Council established by this Treaty have the power of carrying out special inspections in the following cases. In the case of the Council.(i) When so requested, the reasons for the request being stated, by any party which suspects that some activity prohibited by this Treaty has been carried out or is about to be carried out, either in the territory of any other party or in any other place on such latter partys behalf, the Council shall immediately arrange for such an inspection in accordance with article 10, paragraph 5.(ii) When requested by any party which has been suspected of or charged with having violated this Treaty, the Council shall immediately arrange for the special inspection requested in accordance with article 10, paragraph 5.",5,N/A,"Ibid. Article 16. 1The International Atomic Energy Agency and the Council established by this Treaty have the power of carrying out special inspections in the following cases. (…)(b) In the case of the Council.When so requested, the reasons for the request being stated, by any party which suspects that some activity prohibited by this Treaty has been carried out or is about to be carried out, either in the territory of any other party or in any other place on such latter partys behalf, the Council shall immediately arrange for such an inspection in accordance with article 10, paragraph 5. (ii) When requested by any party which has been suspected of or charged with having violated this Treaty, the Council shall immediately arrange for the special inspection requested in accordance with article 10, paragraph 5.",2,N/A,"Ibid. Article 16. 1The International Atomic Energy Agency and the Council established by this Treaty have the power of carrying out special inspections in the following cases. (…)(b) In the case of the Council.When so requested, the reasons for the request being stated, by any party which suspects that some activity prohibited by this Treaty has been carried out or is about to be carried out, either in the territory of any other party or in any other place on such latter partys behalf, the Council shall immediately arrange for such an inspection in accordance with article 10, paragraph 5. (ii) When requested by any party which has been suspected of or charged with having violated this Treaty, the Council shall immediately arrange for the special inspection requested in accordance with article 10, paragraph 5.",1,Inspectors have access to all places and all information which may be necessary for the performance of their duties and which are directly and intimately connected with the suspicion of violation of the agreement.,Ibid. Article 16.4.  all places and all information which may be necessary for the performance of their duties and which are directly and intimately connected with the suspicion of violation of this Treaty. ,0,N/A,N/A,0,N/A,N/A,0,N/A,N/A,2,All places,Ibid. Article 16.4.  all places and all information which may be necessary for the performance of their duties and which are directly and intimately connected with the suspicion of violation of this Treaty. ,2,N/A,The IAEA,N/A,"Ibid. Article 16. 1The International Atomic Energy Agency and the Council established by this Treaty have the power of carrying out special inspections in the following cases. (…)(b) In the case of the Council.When so requested, the reasons for the request being stated, by any party which suspects that some activity prohibited by this Treaty has been carried out or is about to be carried out, either in the territory of any other party or in any other place on such latter partys behalf, the Council shall immediately arrange for such an inspection in accordance with article 10, paragraph 5. (ii) When requested by any party which has been suspected of or charged with having violated this Treaty, the Council shall immediately arrange for the special inspection requested in accordance with article 10, paragraph 5.",0,N/A,N/A,0,N/A,N/A,0,N/A,N/A,0,N/A,N/A,0,N/A,N/A,0,N/A,N/A,0,N/A,N/A,0,N/A,N/A,1,"Challenged Implementation-inspection, initiated at entry into force and activated upon a state-party request for the duration of the agreement. The  objective of the mechanism is to confirm a state party’s compliance, given doubts or suspicions of non-compliance with the agreement. Inspectors are  designated by General Conference and have full and  free access to all places and all information which may  be necessary for the performance of their duties and  which are connected with the suspicion of violation of the  agreement [Article 16].",Ibid. Article 16.4.  all places and all information which may be necessary for the performance of their duties and which are directly and intimately connected with the suspicion of violation of this Treaty. ,0,N/A,0,N/A,Challenged Implementation-inspection
080,A,1,2,0,N/A,N/A,Assumed,1967-10-10,Unoda. Accessed 2024-04-06. https://treaties.unoda.org/t/outer_space.,3,N/A,N/A,Assumed,Available,N/A,2,N/A,N/A,N/A,N/A,N/A,N/A,N/A,"ibid. – Treaty. Article XII. All stations, installations, equipment and space vehicles on the Moon and other celestial bodies shall be open to representatives of other States parties to the Treaty on a basis of reciprocity. Such representatives shall give reasonable advance notice of a projected visit,  .",5,N/A,"ibid. – Treaty. Article XII. All stations, installations, equipment and space vehicles on the Moon and other celestial bodies shall be open to representatives of other States parties to the Treaty on a basis of reciprocity. Such representatives shall give reasonable advance notice of a projected visit,  .",1,N/A,"ibid. – Treaty. Article XII. All stations, installations, equipment and space vehicles on the Moon and other celestial bodies shall be open to representatives of other States parties to the Treaty on a basis of reciprocity. Such representatives shall give reasonable advance notice of a projected visit,  .",1,"Inspectors have access to all stations, installations, equipment and space vehicles on the moon and other celestial bodies [Article XII].","ibid. – Treaty. Article XII. All stations, installations, equipment and space vehicles on the Moon and other celestial bodies shall be open to representatives of other States parties to the Treaty on a basis of reciprocity. Such representatives shall give reasonable advance notice of a projected visit,  .",1,"Within specified territory, inspectors have access to all stations, installations, equipment and space vehicles on the moon and other celestial bodies [Article XII].","ibid. – Treaty. Article XII. All stations, installations, equipment and space vehicles on the Moon and other celestial bodies shall be open to representatives of other States parties to the Treaty on a basis of reciprocity. Such representatives shall give reasonable advance notice of a projected visit,  .",1,"On-site/locations, inspectors have access to all stations, installations, equipment and space vehicles on the moon and other celestial bodies [Article XII].","ibid. – Treaty. Article XII. All stations, installations, equipment and space vehicles on the Moon and other celestial bodies shall be open to representatives of other States parties to the Treaty on a basis of reciprocity. Such representatives shall give reasonable advance notice of a projected visit,  .",0,N/A,N/A,2,"Moon, other celestial bodies","ibid. – Treaty. Article XII. All stations, installations, equipment and space vehicles on the Moon and other celestial bodies shall be open to representatives of other States parties to the Treaty on a basis of reciprocity. Such representatives shall give reasonable advance notice of a projected visit,  .",0,N/A,N/A,N/A,"ibid. – Treaty. Article XII. All stations, installations, equipment and space vehicles on the Moon and other celestial bodies shall be open to representatives of other States parties to the Treaty on a basis of reciprocity. Such representatives shall give reasonable advance notice of a projected visit,  .",0,N/A,N/A,0,N/A,N/A,0,N/A,N/A,0,N/A,N/A,0,N/A,N/A,0,N/A,N/A,0,N/A,N/A,0,N/A,N/A,1,"Updated Implementation-inspection, initiated at entry into force and activated on a basis of reciprocity for the duration of the agreement. Inspectors have access to all stations, installations, equipment and space vehicles on the moon and other celestial bodies [Article XII].","ibid. – Treaty. Article XII. All stations, installations, equipment and space vehicles on the Moon and other celestial bodies shall be open to representatives of other States parties to the Treaty on a basis of reciprocity. Such representatives shall give reasonable advance notice of a projected visit,  .",0,N/A,0,N/A,Updated Implementation-Inspection
